node	label	primary_terms_baseline	secondary_terms_patch_weighted	contextual_terms_patch_weighted	secondary_slot_usage	contextual_slot_usage	rationale
cs255	Indicative with ὅτι	hoti, indicative (pre-existing query_axis.tsv terms)	complement(df7->0.51), content(df5->0.60), object(df27->0.42)	(none)	3/5	0/3	All 3 tokens from expansion_patch.tsv (Phase 3.9) retained, none dropped. "object" is the most frequency-discounted (df=27, 2.6%) since it also legitimately appears across many unrelated Object-Complement-cluster nodes; this is exactly the term that caused the original Phase 3.8 ambiguous-expansion-failure tie, so discounting it here is intentional and targeted.
cs262	Epexegetical	epexegetical (pre-existing)	complement(df7->0.51), content(df5->0.60)	(none)	2/5	0/3	Both tokens from expansion_patch.tsv retained. Lower secondary-slot usage than cs255 reflects that "Epexegetical" recurs legitimately at 4 ontology locations (Phase 3.6 finding) and does not need additional broad coverage.
cs387	Indirect Discourse (under Participle root)	(pre-existing query_axis.tsv terms for this node)	perception(df1->0.60), supplementary(df1->0.60), accusative(df24->0.42), verb(df16->0.42), participle(df11->0.51)	(none)	5/5 (AT CAP)	0/3	All 5 distinct tokens from the original Phase 3.9 patch text ("verb of perception; perception verb; supplementary participle; accusative plus participle") are retained -- an earlier draft of this re-tiering dropped "verb" and "participle", which caused a genuine recall regression (see disambiguation_rules.tsv row 8 for the catch and fix). This node is now at its 5/5 secondary cap: any future addition here must either replace an existing term or move into the remaining 3 contextual slots.
cs260	Indirect Discourse	indirect, discourse (pre-existing)	object(df27->0.42), reported(df1->0.60), speech(df2->0.60)	(none)	3/5	0/3	All 3 tokens from expansion_patch.tsv retained.
cs378	Temporal	temporal (pre-existing; only term before Phase 3.11)	duration(df0->0.60), chronology(df0->0.60)	time(df23->0.21)	2/5	1/3	"time" is deliberately demoted from secondary to contextual tier specifically because of its high document frequency (df=23/1032=2.2%, shared with 22 other nodes including the literal "Genitive/Nominative/Dative of Time" case categories) -- this is the direct fix for the reported "cs378: time系ノードの過剰ヒット(45件)" complaint. "duration"/"chronology" stay at secondary tier since both have df=0 (unique to this patch, no collision risk).
